{
  "id": "intuit",
  "name": "Intuit Inc.",
  "kind": "public_company",
  "category": "enterprise_software",
  "group": "software_applications",
  "region": "us",
  "tier": 2,
  "tickers": [
    {
      "exchange": "NASDAQ",
      "symbol": "INTU"
    }
  ],
  "cik": "896878",
  "website": "https://www.intuit.com",
  "fiscal_year_end": "07-31",
  "monetization": "Sells TurboTax, QuickBooks, Credit Karma, and Mailchimp; pays OpenAI >$100M multi-year for model access and distribution of its apps inside ChatGPT.",
  "description_md": "Intuit is a financial-software incumbent using frontier models two ways: embedding OpenAI models in its own 'done-for-you' agentic experiences, and distributing TurboTax/QuickBooks/Credit Karma/Mailchimp as apps inside ChatGPT (announced Nov 18, 2025). One of the clearest examples of an app-layer company paying nine figures for model access — the demand side of AI revenue quality.",
  "observations": [
    {
      "metric": "contract_value",
      "metric_label": "OpenAI model-access and ChatGPT distribution deal",
      "period": "2025-11",
      "value": 100,
      "unit": "USD_M",
      "basis": "press_reported",
      "confidence": "medium",
      "source": {
        "url": "https://www.cnbc.com/2025/11/18/intuit-pays-openai-100-million-turbotax-integrates-chatgpt.html",
        "publisher": "CNBC",
        "published": "2025-11-18",
        "kind": "press"
      },
      "as_of": "2026-08-13",
      "notes": "Reported as 'more than $100 million' multi-year; some coverage characterizes it as an annual figure. Exact structure undisclosed."
    },
    {
      "metric": "revenue_total",
      "period": "12-month to 2026-07-31 (FY FY2026, 10-K)",
      "value": 21.45,
      "unit": "USD_B",
      "basis": "disclosed",
      "confidence": "high",
      "source": {
        "url": "https://data.sec.gov/api/xbrl/companyconcept/CIK0000896878/us-gaap/RevenueFromContractWithCustomerExcludingAssessedTax.json",
        "publisher": "SEC EDGAR (XBRL)",
        "published": "2026-09-09",
        "kind": "sec_filing"
      },
      "as_of": "2026-10-04",
      "notes": "RevenueFromContractWithCustomerExcludingAssessedTax; 12-month duration value — 10-Q figures can be year-to-date, not single-quarter; auto-ingested from 10-K."
    },
    {
      "metric": "capex",
      "period": "12-month to 2026-07-31 (FY FY2026, 10-K)",
      "value": 0.18,
      "unit": "USD_B",
      "basis": "disclosed",
      "confidence": "high",
      "source": {
        "url": "https://data.sec.gov/api/xbrl/companyconcept/CIK0000896878/us-gaap/PaymentsToAcquirePropertyPlantAndEquipment.json",
        "publisher": "SEC EDGAR (XBRL)",
        "published": "2026-09-09",
        "kind": "sec_filing"
      },
      "as_of": "2026-10-04",
      "notes": "PaymentsToAcquirePropertyPlantAndEquipment; 12-month duration value — 10-Q figures can be year-to-date, not single-quarter; cash payments, may exclude finance leases; auto-ingested from 10-K."
    },
    {
      "metric": "market_cap",
      "period": "2026-10-04",
      "value": 76.9,
      "unit": "USD_B",
      "basis": "disclosed",
      "confidence": "high",
      "source": {
        "url": "https://api-ninjas.com/api/marketcap",
        "publisher": "API Ninjas",
        "published": "2026-10-04",
        "kind": "dataset"
      },
      "as_of": "2026-10-04",
      "notes": "Exchange market cap for INTU; auto-refreshed weekly."
    }
  ],
  "sources": [
    {
      "url": "https://investors.intuit.com/news-events/press-releases/detail/1284/intuit-and-openai-join-forces-to-revolutionize-financial-intelligence-powering-every-person-business-and-dream-with-personalized-experiences",
      "publisher": "Intuit IR",
      "published": "2025-11-18",
      "kind": "company_pr"
    },
    {
      "url": "https://www.axios.com/2025/11/18/openai-intuit-turbotax-quickbooks-chatgpt",
      "publisher": "Axios",
      "published": "2025-11-18",
      "kind": "press"
    }
  ],
  "updated": "2026-10-04"
}
