{
  "id": "blue-owl",
  "name": "Blue Owl Capital Inc.",
  "kind": "financial_institution",
  "category": "financier_private_credit",
  "group": "capital",
  "region": "us",
  "tier": 1,
  "tickers": [
    {
      "exchange": "NYSE",
      "symbol": "OWL"
    }
  ],
  "cik": "1823945",
  "website": "https://www.blueowl.com",
  "fiscal_year_end": "12-31",
  "monetization": "Alternative asset manager (~$319B AUM) earning fees on private credit and net-lease capital deployed into AI data centers; majority owner of Meta's Hyperion JV and a Stargate Abilene JV partner.",
  "description_md": "Blue Owl Capital is a publicly traded alternative asset manager spanning direct lending, GP strategic capital, and real assets, with AUM of $319B at June 30, 2026. It has become the signature financier of the off-balance-sheet AI data-center structure: its funds own 80% of Meta's Hyperion JV and it anchors the Stargate Abilene project JV alongside Crusoe and Primary Digital Infrastructure.",
  "ai_monetization_md": "AI-exposure thesis: earn management fees and net-lease/credit spreads on hyperscaler-backed data-center assets while the tenant's investment-grade lease (rather than Blue Owl's balance sheet) carries the risk. Flagships: 80% of the Hyperion JV ($27B+ senior secured notes via Beignet Investor LLC plus ~$2.5B equity, Meta as sole tenant with a residual-value guarantee); the $15B Stargate Abilene JV with Crusoe and Primary Digital Infrastructure (JPMorgan-led $2.3B and $7.1B construction loans); and an AWS-anchored campus pipeline via its Beale Infrastructure platform (Tucson, AZ). A reported ~$12B Amazon data-center campus commitment appears in press aggregations but is UNVERIFIED against a primary source.",
  "risk_notes_md": "Concentration in very large single-tenant AI leases (Meta, OpenAI/Oracle ecosystem) means fee-earning assets and credit performance ride on a handful of hyperscaler counterparties. Recovery values on purpose-built AI campuses if a lease terminates are untested; the Hyperion structure leans on Meta's 16-year residual-value guarantee. Blue Owl showed selectivity by withdrawing from the ~$10B financing for Oracle's Michigan (Saline Township) data center in Dec 2025 — a reminder that private-credit appetite for AI paper is conditional.",
  "observations": [
    {
      "metric": "other",
      "metric_label": "Assets under management",
      "period": "FY2026-Q2",
      "value": 319,
      "unit": "USD_B",
      "basis": "disclosed",
      "confidence": "high",
      "source": {
        "url": "https://www.sec.gov/Archives/edgar/data/0001823945/000182394526000036/a63026-ex991xearningspress.htm",
        "publisher": "SEC / Blue Owl 8-K",
        "published": "2026-07-30",
        "kind": "sec_filing"
      },
      "as_of": "2026-08-13",
      "notes": "$190.6B fee-paying AUM. Q1 2026 AUM was $315B — the figure most often quoted in press."
    },
    {
      "metric": "other",
      "metric_label": "Hyperion JV ownership",
      "period": "2025-10",
      "value": 80,
      "unit": "pct",
      "basis": "disclosed",
      "confidence": "high",
      "source": {
        "url": "https://www.prnewswire.com/news-releases/meta-announces-joint-venture-with-funds-managed-by-blue-owl-capital-to-develop-hyperion-data-center-302590584.html",
        "publisher": "Meta / PR Newswire",
        "published": "2025-10",
        "kind": "company_pr"
      },
      "as_of": "2026-08-13",
      "notes": "Funds managed by Blue Owl hold 80%; Meta retains 20% and is sole tenant."
    },
    {
      "metric": "contract_value",
      "metric_label": "Stargate Abilene JV (with Crusoe, Primary Digital)",
      "period": "2025",
      "value": 15,
      "unit": "USD_B",
      "basis": "company_claimed",
      "confidence": "medium",
      "source": {
        "url": "https://www.crusoe.ai/resources/newsroom/crusoe-blue-owl-capital-and-primary-digital-infrastructure-enter-joint-venture",
        "publisher": "Crusoe",
        "published": "2025",
        "kind": "company_pr"
      },
      "as_of": "2026-08-13",
      "notes": "JV for the OpenAI/Oracle Abilene, TX campus; financed in part by JPMorgan-led $2.3B and $7.1B construction loans."
    },
    {
      "metric": "revenue_total",
      "period": "6-month to 2026-06-30 (Q2 FY2026, 10-Q)",
      "value": 1.51,
      "unit": "USD_B",
      "basis": "disclosed",
      "confidence": "high",
      "source": {
        "url": "https://data.sec.gov/api/xbrl/companyconcept/CIK0001823945/us-gaap/RevenueFromContractWithCustomerExcludingAssessedTax.json",
        "publisher": "SEC EDGAR (XBRL)",
        "published": "2026-07-31",
        "kind": "sec_filing"
      },
      "as_of": "2026-09-27",
      "notes": "RevenueFromContractWithCustomerExcludingAssessedTax; 6-month duration value — 10-Q figures can be year-to-date, not single-quarter; auto-ingested from 10-Q."
    },
    {
      "metric": "capex",
      "period": "6-month to 2026-06-30 (Q2 FY2026, 10-Q)",
      "value": 0.02,
      "unit": "USD_B",
      "basis": "disclosed",
      "confidence": "high",
      "source": {
        "url": "https://data.sec.gov/api/xbrl/companyconcept/CIK0001823945/us-gaap/PaymentsToAcquirePropertyPlantAndEquipment.json",
        "publisher": "SEC EDGAR (XBRL)",
        "published": "2026-07-31",
        "kind": "sec_filing"
      },
      "as_of": "2026-09-27",
      "notes": "PaymentsToAcquirePropertyPlantAndEquipment; 6-month duration value — 10-Q figures can be year-to-date, not single-quarter; cash payments, may exclude finance leases; auto-ingested from 10-Q."
    }
  ],
  "events": [
    {
      "date": "2025-10-16",
      "title": "Hyperion JV prices $27.3B senior secured notes",
      "why_it_matters": "The largest private-placement data-center financing on record; Blue Owl's 80% JV stake makes it the principal off-balance-sheet partner to Meta's biggest capex project.",
      "impact": "high",
      "entities": [
        "blue-owl",
        "meta",
        "hyperion-jv",
        "pimco"
      ],
      "sources": [
        {
          "url": "https://www.bisnow.com/national/news/data-center-capital-markets/meta-pushes-its-largest-data-center-project-off-its-books-with-27b-joint-venture-131490",
          "publisher": "Bisnow",
          "published": "2025-10",
          "kind": "press"
        }
      ]
    },
    {
      "date": "2025-12-17",
      "title": "Withdraws from ~$10B financing of Oracle's Michigan data center",
      "why_it_matters": "Oracle shares fell ~5% on the news; the pullback (the deal was later anchored by PIMCO) marked the first visible crack in private-credit appetite for AI project paper.",
      "impact": "medium",
      "entities": [
        "blue-owl",
        "oracle",
        "pimco"
      ],
      "sources": [
        {
          "url": "https://www.cnbc.com/2025/12/17/oracle-stock-blue-owl-michigan-data-center.html",
          "publisher": "CNBC",
          "published": "2025-12-17",
          "kind": "press"
        }
      ]
    }
  ],
  "sources": [
    {
      "url": "https://www.sec.gov/Archives/edgar/data/0001823945/000182394526000036/a63026-ex991xearningspress.htm",
      "publisher": "SEC / Blue Owl 8-K",
      "published": "2026-07-30",
      "kind": "sec_filing"
    },
    {
      "url": "https://www.prnewswire.com/news-releases/meta-announces-joint-venture-with-funds-managed-by-blue-owl-capital-to-develop-hyperion-data-center-302590584.html",
      "publisher": "Meta / PR Newswire",
      "published": "2025-10",
      "kind": "company_pr"
    },
    {
      "url": "https://www.datacenterfrontier.com/site-selection/article/55262957/blue-owl-swoops-in-as-major-backer-of-new-high-profile-sustainable-us-data-center-construction",
      "publisher": "Data Center Frontier",
      "kind": "press",
      "notes": "Covers Beale Infrastructure AWS-anchored Tucson campus."
    }
  ],
  "updated": "2026-09-27"
}
